{
  "asset_id": "US-EQ-ALPHA",
  "contract_name": "finnews-paper-execution-v1",
  "contract_version": "1.0.0",
  "created_at": "2026-06-25T00:00:00+00:00",
  "currency": "USD",
  "decision_time": "2026-06-25T00:00:00+00:00",
  "direction": "positive",
  "expires_at": "2026-06-26T00:00:00+00:00",
  "idempotency_key": "example-paper-idempotency-key",
  "manual_approval_state": "pending_review",
  "not_investment_advice": true,
  "paper_notional": "2500.000000",
  "paper_order_id": "paper-order-example-001",
  "paper_quantity_units": "24.500000",
  "paper_side": "long",
  "payload_hash": "7f597f1248b14b016bbe8cc556464435a0970b1d0ecc45264170b32d6907fddb",
  "reason_codes": [
    "paper_only",
    "manual_review_required"
  ],
  "risk_decision": "approved_for_paper",
  "risk_policy_id": "paper-risk-m4b0-default-v1",
  "signal_id": "SIGNAL-EXAMPLE",
  "synthetic_data": true
}
